{
  "version": 1,
  "exportDate": "2026-02-07T12:00:00Z",
  "appVersion": "1.0.0",
  "userProfile": {
    "id": 1,
    "name": "Sabine Müller",
    "street": "Yogaweg 12",
    "postalCode": "80331",
    "city": "München",
    "taxId": "143/123/45678",
    "phone": "+49 176 12345678",
    "email": "sabine@yoga-muenchen.de",
    "bankName": "Stadtsparkasse München",
    "iban": "DE89 3704 0044 0532 0130 00",
    "bic": "SSKMDEMMXXX",
    "defaultHourlyRate": 55.0,
    "isOnboardingComplete": true
  },
  "studios": [
    {
      "id": 1,
      "name": "Yogaraum Schwabing",
      "contactPerson": "Anna Berger",
      "email": "anna@yogaraum-schwabing.de",
      "phone": "+49 89 12345678",
      "street": "Leopoldstraße 42",
      "postalCode": "80802",
      "city": "München",
      "hourlyRate": 60.0,
      "isActive": true
    },
    {
      "id": 2,
      "name": "Balance Studio Haidhausen",
      "contactPerson": "Markus Weber",
      "email": "info@balance-haidhausen.de",
      "phone": "+49 89 87654321",
      "street": "Rosenheimer Str. 105",
      "postalCode": "81667",
      "city": "München",
      "hourlyRate": 50.0,
      "isActive": true
    },
    {
      "id": 3,
      "name": "Zen Yoga Sendling",
      "contactPerson": "Lisa Schmitt",
      "email": "lisa@zen-yoga.de",
      "phone": "+49 89 55512345",
      "street": "Daiserstraße 8",
      "postalCode": "81371",
      "city": "München",
      "hourlyRate": 55.0,
      "isActive": false
    }
  ],
  "templates": [
    {
      "id": 1,
      "name": "Montag Morgen Hatha",
      "studioId": 1,
      "className": "Hatha Yoga",
      "dayOfWeek": "MONDAY",
      "startTime": "09:00",
      "endTime": "10:15",
      "duration": 1.25,
      "isActive": true,
      "autoSchedule": true,
      "lastScheduledDate": "2026-02-03"
    },
    {
      "id": 2,
      "name": "Mittwoch Abend Vinyasa",
      "studioId": 1,
      "className": "Vinyasa Flow",
      "dayOfWeek": "WEDNESDAY",
      "startTime": "18:00",
      "endTime": "19:30",
      "duration": 1.5,
      "isActive": true,
      "autoSchedule": false,
      "lastScheduledDate": null
    },
    {
      "id": 3,
      "name": "Donnerstag Mittag Yin",
      "studioId": 2,
      "className": "Yin Yoga",
      "dayOfWeek": "THURSDAY",
      "startTime": "12:00",
      "endTime": "13:15",
      "duration": 1.25,
      "isActive": true,
      "autoSchedule": false,
      "lastScheduledDate": null
    },
    {
      "id": 4,
      "name": "Freitag Morgen Anfänger",
      "studioId": 2,
      "className": "Yoga für Anfänger",
      "dayOfWeek": "FRIDAY",
      "startTime": "10:00",
      "endTime": "11:15",
      "duration": 1.25,
      "isActive": true,
      "autoSchedule": false,
      "lastScheduledDate": null
    },
    {
      "id": 5,
      "name": "Samstag Morgen Power (inaktiv)",
      "studioId": 3,
      "className": "Power Yoga",
      "dayOfWeek": "SATURDAY",
      "startTime": "10:00",
      "endTime": "11:30",
      "duration": 1.5,
      "isActive": false,
      "autoSchedule": false,
      "lastScheduledDate": null
    }
  ],
  "classes": [
    {
      "id": 1,
      "studioId": 1,
      "title": "Hatha Yoga",
      "startTime": "2025-12-01T09:00",
      "endTime": "2025-12-01T10:15",
      "durationHours": 1.25,
      "status": "COMPLETED",
      "notes": "",
      "creationSource": "TEMPLATE",
      "sourceTemplateId": 1
    },
    {
      "id": 2,
      "studioId": 1,
      "title": "Vinyasa Flow",
      "startTime": "2025-12-03T18:00",
      "endTime": "2025-12-03T19:30",
      "durationHours": 1.5,
      "status": "COMPLETED",
      "notes": "",
      "creationSource": "TEMPLATE",
      "sourceTemplateId": 2
    },
    {
      "id": 3,
      "studioId": 2,
      "title": "Yin Yoga",
      "startTime": "2025-12-04T12:00",
      "endTime": "2025-12-04T13:15",
      "durationHours": 1.25,
      "status": "COMPLETED",
      "notes": "Kleine Gruppe, sehr entspannt",
      "creationSource": "TEMPLATE",
      "sourceTemplateId": 3
    },
    {
      "id": 4,
      "studioId": 1,
      "title": "Hatha Yoga",
      "startTime": "2025-12-08T09:00",
      "endTime": "2025-12-08T10:15",
      "durationHours": 1.25,
      "status": "COMPLETED",
      "notes": "",
      "creationSource": "AUTO",
      "sourceTemplateId": 1
    },
    {
      "id": 5,
      "studioId": 1,
      "title": "Vinyasa Flow",
      "startTime": "2025-12-10T18:00",
      "endTime": "2025-12-10T19:30",
      "durationHours": 1.5,
      "status": "CANCELLED",
      "notes": "Studio geschlossen wegen Wasserschaden",
      "creationSource": "TEMPLATE",
      "sourceTemplateId": 2
    },
    {
      "id": 6,
      "studioId": 2,
      "title": "Yoga für Anfänger",
      "startTime": "2025-12-12T10:00",
      "endTime": "2025-12-12T11:15",
      "durationHours": 1.25,
      "status": "COMPLETED",
      "notes": "",
      "creationSource": "TEMPLATE",
      "sourceTemplateId": 4
    },
    {
      "id": 7,
      "studioId": 1,
      "title": "Hatha Yoga",
      "startTime": "2025-12-15T09:00",
      "endTime": "2025-12-15T10:15",
      "durationHours": 1.25,
      "status": "COMPLETED",
      "notes": "",
      "creationSource": "AUTO",
      "sourceTemplateId": 1
    },
    {
      "id": 8,
      "studioId": 2,
      "title": "Yin Yoga",
      "startTime": "2025-12-18T12:00",
      "endTime": "2025-12-18T13:15",
      "durationHours": 1.25,
      "status": "COMPLETED",
      "notes": "",
      "creationSource": "MANUAL",
      "sourceTemplateId": null
    },
    {
      "id": 9,
      "studioId": 1,
      "title": "Hatha Yoga",
      "startTime": "2025-12-22T09:00",
      "endTime": "2025-12-22T10:15",
      "durationHours": 1.25,
      "status": "COMPLETED",
      "notes": "Letzte Stunde vor Weihnachten",
      "creationSource": "AUTO",
      "sourceTemplateId": 1
    },
    {
      "id": 10,
      "studioId": 1,
      "title": "Hatha Yoga",
      "startTime": "2026-01-06T09:00",
      "endTime": "2026-01-06T10:15",
      "durationHours": 1.25,
      "status": "COMPLETED",
      "notes": "",
      "creationSource": "AUTO",
      "sourceTemplateId": 1
    },
    {
      "id": 11,
      "studioId": 1,
      "title": "Vinyasa Flow",
      "startTime": "2026-01-07T18:00",
      "endTime": "2026-01-07T19:30",
      "durationHours": 1.5,
      "status": "COMPLETED",
      "notes": "",
      "creationSource": "TEMPLATE",
      "sourceTemplateId": 2
    },
    {
      "id": 12,
      "studioId": 2,
      "title": "Yin Yoga",
      "startTime": "2026-01-08T12:00",
      "endTime": "2026-01-08T13:15",
      "durationHours": 1.25,
      "status": "COMPLETED",
      "notes": "",
      "creationSource": "TEMPLATE",
      "sourceTemplateId": 3
    },
    {
      "id": 13,
      "studioId": 2,
      "title": "Yoga für Anfänger",
      "startTime": "2026-01-09T10:00",
      "endTime": "2026-01-09T11:15",
      "durationHours": 1.25,
      "status": "COMPLETED",
      "notes": "",
      "creationSource": "TEMPLATE",
      "sourceTemplateId": 4
    },
    {
      "id": 14,
      "studioId": 1,
      "title": "Hatha Yoga",
      "startTime": "2026-01-13T09:00",
      "endTime": "2026-01-13T10:15",
      "durationHours": 1.25,
      "status": "COMPLETED",
      "notes": "",
      "creationSource": "AUTO",
      "sourceTemplateId": 1
    },
    {
      "id": 15,
      "studioId": 1,
      "title": "Vinyasa Flow",
      "startTime": "2026-01-14T18:00",
      "endTime": "2026-01-14T19:30",
      "durationHours": 1.5,
      "status": "COMPLETED",
      "notes": "",
      "creationSource": "TEMPLATE",
      "sourceTemplateId": 2
    },
    {
      "id": 16,
      "studioId": 2,
      "title": "Yin Yoga",
      "startTime": "2026-01-15T12:00",
      "endTime": "2026-01-15T13:15",
      "durationHours": 1.25,
      "status": "CANCELLED",
      "notes": "Krank",
      "creationSource": "TEMPLATE",
      "sourceTemplateId": 3
    },
    {
      "id": 17,
      "studioId": 1,
      "title": "Hatha Yoga",
      "startTime": "2026-01-20T09:00",
      "endTime": "2026-01-20T10:15",
      "durationHours": 1.25,
      "status": "COMPLETED",
      "notes": "",
      "creationSource": "AUTO",
      "sourceTemplateId": 1
    },
    {
      "id": 18,
      "studioId": 1,
      "title": "Hatha Yoga",
      "startTime": "2026-01-27T09:00",
      "endTime": "2026-01-27T10:15",
      "durationHours": 1.25,
      "status": "COMPLETED",
      "notes": "",
      "creationSource": "AUTO",
      "sourceTemplateId": 1
    },
    {
      "id": 19,
      "studioId": 1,
      "title": "Hatha Yoga",
      "startTime": "2026-02-02T09:00",
      "endTime": "2026-02-02T10:15",
      "durationHours": 1.25,
      "status": "COMPLETED",
      "notes": "",
      "creationSource": "AUTO",
      "sourceTemplateId": 1
    },
    {
      "id": 20,
      "studioId": 1,
      "title": "Vinyasa Flow",
      "startTime": "2026-02-04T18:00",
      "endTime": "2026-02-04T19:30",
      "durationHours": 1.5,
      "status": "COMPLETED",
      "notes": "",
      "creationSource": "TEMPLATE",
      "sourceTemplateId": 2
    },
    {
      "id": 21,
      "studioId": 2,
      "title": "Yin Yoga",
      "startTime": "2026-02-05T12:00",
      "endTime": "2026-02-05T13:15",
      "durationHours": 1.25,
      "status": "COMPLETED",
      "notes": "",
      "creationSource": "TEMPLATE",
      "sourceTemplateId": 3
    },
    {
      "id": 22,
      "studioId": 1,
      "title": "Hatha Yoga",
      "startTime": "2026-02-09T09:00",
      "endTime": "2026-02-09T10:15",
      "durationHours": 1.25,
      "status": "SCHEDULED",
      "notes": "",
      "creationSource": "AUTO",
      "sourceTemplateId": 1
    },
    {
      "id": 23,
      "studioId": 1,
      "title": "Vinyasa Flow",
      "startTime": "2026-02-11T18:00",
      "endTime": "2026-02-11T19:30",
      "durationHours": 1.5,
      "status": "SCHEDULED",
      "notes": "",
      "creationSource": "TEMPLATE",
      "sourceTemplateId": 2
    },
    {